,0,1,2,3,4
0,,Aseel Farhat Whyburn Instructor,P.O Box 400137 Dept. of Mathematics 303 Kerchof Hall,434-243-8748 af7py@virginia.edu,
1,,Luis Pereira Mary Ann Pitts Post-Doctoral Fellow in Mathematics,P. O. Box 400137 Dept. of Mathematics 129 Kerchof Hall,434-924-8996 lp2h@virginia.edu,
2,,Axel Saenz-Rodriguez Mary Ann Pitts Postdoctoral Fellow,P.O. Box 400137 Dept. of Mathematics 221 Kerchof Hall,434-243-8778 ais6a@virginia.edu,
3,,Ramanujan Santharoubane Whyburn Instructor,P.O. Box 400137 Dept. of Mathematics 229 Kerchof Hall,434-243-8778 rhs8e@virginia.edu,
4,,Lloyd West  Research Fellow,P.O Box 400137 Dept. of Mathematics 229 Kerchof Hall,434-924-4944 lww8k@virginia.edu,
5,,Zezhou Zhang Whyburn Instructor,P. O. Box 400137 	Dept. of Mathematics 	223 Kerchof Hall,434-924-4939 zz2d@virginia.edu,
